Cryptogram,Encrypted Author,Rating,Quote,Author
"YN CVIGPT OL NLA GR WTO YCSSGTV: GK NLA KGEV C WLLV XGKT NLA’UU JT FCBBN; GK ELO, NLA’UU JTPLYT C BFGULRLBFTS.",RLPSCOTR,hard,"My advice to you is get married: If you find a good wife you’ll be happy; if not, you’ll become a philosopher.",Socrates
"JRGJFR MDS EGURS YM UGC CAR QRS CG ADJJYURMM, LNC Y ADWR DFBDSM TYHNKRP YT SGN ADWR RUGNHA EGURS, SGN ODU ADWR D QRS EDPR.",ZGDU KYWRKM,hard,"People say money is not the key to happiness, but I have always figured if you have enough money, you can have a key made.",Joan Rivers
NHWD NDHHYH SR NY OXTD WM YCD AYHCSCL XCU USRBYGDH NJXN EYWH JSLJ RBJYYV BVXRR SR HWCCSCL NJD BYWCNHE.,TWHN GYCCDLWN,hard,True terror is to wake up one morning and discover that your high school class is running the country.,Kurt Vonnegut
A TFCTGW RLLE CAVS CAID. WLXDVAXDW A DYDI TPP AV VL VSD BLLP.,C.R. BADFPW,hard,I always cook with wine. Sometimes I even add it to the food.,W.C. Fields
"FTT UQN UQKLYD K TKEN UV HV FMN NKUQNM KJJVMFT, KTTNYFT, VM AFUUNLKLY.",FTNBFLHNM SVVTTGVUU,hard,"All the things I like to do are either immoral, illegal, or fattening.",Alexander Woollcott
AB IUQBLZF UACZH QBUTYGJ NBUFHN ACCEW. OCZ RUO TYB CL U RYWXQYGH.,RUQE HVUYG,hard,Be careful about reading health books. You may die of a misprint.,Mark Twain
LHQW MPVLW OPTTYDWLL BOWXWJWX IOWG SH; HIOWXL BOWDWJWX IOWG SH.,PDHDGQHVL,hard,Some cause happiness wherever they go; others whenever they go.,Anonymous
